<?xml version="1.0" encoding="UTF-8"?>
<Header xmlns:xsi="http://www.w3.org/2001/XMLSchema-instance" Version="5.1" xsi:noNamespaceSchemaLocation="LeistungsschnittstelleV51.xsd">
	<ReceivingApplication>TARDOC Test</ReceivingApplication>
	<ReceivingFacility>1234</ReceivingFacility>
	<ReceivingServiceCode>Labor</ReceivingServiceCode>
	<SendingApplication>ALIS</SendingApplication>
	<SendingFacility>4321</SendingFacility>
	<SendingServiceCode>4321</SendingServiceCode>
	<MessageControlID>1262557</MessageControlID>
	<SoftwareReleaseNumber>1.1.0</SoftwareReleaseNumber>
	<FileCreationDate>2025-04-07T10:06:44Z</FileCreationDate>
	<Visit>
		<VisitNumber>987654</VisitNumber>
		<PatientID>102</PatientID>
		<PatientName>Tester</PatientName>
		<PatientGivenName>Paul</PatientGivenName>
		<PatientBirthDate>1982-03-22</PatientBirthDate>
		<PatientGender>M</PatientGender>
		<Service Transaction="insert">
			<ServiceDate>2025-03-04T09:00:00Z</ServiceDate>
			<SessionID>1</SessionID>
			<OrderID>2025403-2</OrderID>
			<ReferrerID>007</ReferrerID>
			<ServiceType>AL2025</ServiceType>
			<ServiceItem>1368.00</ServiceItem>
			<EnteredDateTime>2025-05-05T10:05:36Z</EnteredDateTime>			
			<ProviderID>2700</ProviderID>
			<EnteredBy>7653253256988</EnteredBy>
			<ItemNumber>46784</ItemNumber>
			<Quantity>1</Quantity>
			<ServiceAssignment>
				<OrderingProviderID>7653253258966</OrderingProviderID>
				<OrderReportDate>2025-03-04T10:05:36Z</OrderReportDate>
				<FollowUpOrder>0</FollowUpOrder>
			</ServiceAssignment>
		</Service>
	</Visit>
</Header>